{
  "schema_version": "0.2.0",
  "protocol_version": "0.6.0",
  "game_uid": "12345678-1234-4234-8234-123456789abc",
  "group_id": "GRP00001",
  "role": "police",
  "config_digest": "aaaaaaaaaaaaaaaaaaaaaaaaaaaaaaaaaaaaaaaaaaaaaaaaaaaaaaaaaaaaaaaa",
  "scent_model_digest": "bbbbbbbbbbbbbbbbbbbbbbbbbbbbbbbbbbbbbbbbbbbbbbbbbbbbbbbbbbbbbbbb",
  "capabilities": {"llm_movement": false},
  "hardware": {
    "operating_system": "Conformance OS",
    "cpu_model": "Conformance CPU",
    "cpu_cores": 4,
    "cpu_frequency_mhz": null,
    "ram_bytes": 8000000000,
    "gpu_model": null,
    "vram_bytes": null,
    "timezone": "UTC"
  },
  "software": {
    "code_version": "0.6.0",
    "played_commit": "aaaaaaaaaaaaaaaaaaaaaaaaaaaaaaaaaaaaaaaa",
    "model_provider": "template",
    "model_name": "deterministic-template",
    "estimated_tokens": 0,
    "llm_movement_enabled": false
  }
}
